,Unnamed: 0,Unnamed: 0.1,Unnamed: 0.1.1,Unnamed: 0.1.1.1,topic,problem,status,link
0,0,0,0,0,,,,
1,1,1,1,1,Array,Reverse the array,Y,https://www.geeksforgeeks.org/write-a-program-to-reverse-an-array-or-string/
2,2,2,2,2,Array,Find the maximum and minimum element in an array,Y,https://www.geeksforgeeks.org/maximum-and-minimum-in-an-array/
3,3,3,3,3,Array,"Find the ""Kth"" max and min element of an array ",Y,https://practice.geeksforgeeks.org/problems/kth-smallest-element/0
4,4,4,4,4,Array,"Given an array which consists of only 0, 1 and 2. Sort the array without using any sorting algo",Y,https://practice.geeksforgeeks.org/problems/sort-an-array-of-0s-1s-and-2s/0
5,5,5,5,5,Array,Move all the negative elements to one side of the array ,Y,https://www.geeksforgeeks.org/move-negative-numbers-beginning-positive-end-constant-extra-space/
6,6,6,6,6,Array,Find the Union and Intersection of the two sorted arrays.,Y,https://practice.geeksforgeeks.org/problems/union-of-two-arrays/0
7,7,7,7,7,Array,Write a program to cyclically rotate an array by one.,Y,https://practice.geeksforgeeks.org/problems/cyclically-rotate-an-array-by-one/0
8,8,8,8,8,Array,find Largest sum contiguous Subarray [V. IMP],Y,https://practice.geeksforgeeks.org/problems/kadanes-algorithm/0
9,9,9,9,9,Array,Minimise the maximum difference between heights [V.IMP],Y,https://practice.geeksforgeeks.org/problems/minimize-the-heights3351/1
10,10,10,10,10,Array,Minimum no. of Jumps to reach end of an array,N,https://practice.geeksforgeeks.org/problems/minimum-number-of-jumps/0
11,11,11,11,11,Array,find duplicate in an array of N+1 Integers,N,https://leetcode.com/problems/find-the-duplicate-number/
12,12,12,12,12,Array,Merge 2 sorted arrays without using Extra space.,N,https://practice.geeksforgeeks.org/problems/merge-two-sorted-arrays5135/1
13,13,13,13,13,Array,Kadane's Algo [V.V.V.V.V IMP],N,https://practice.geeksforgeeks.org/problems/kadanes-algorithm/0
14,14,14,14,14,Array,Merge Intervals,N,https://leetcode.com/problems/merge-intervals/
15,15,15,15,15,Array,Next Permutation,N,https://leetcode.com/problems/next-permutation/
16,16,16,16,16,Array,Count Inversion,N,https://practice.geeksforgeeks.org/problems/inversion-of-array/0
17,17,17,17,17,Array,Best time to buy and Sell stock,N,https://leetcode.com/problems/best-time-to-buy-and-sell-stock/
18,18,18,18,18,Array,find all pairs on integer array whose sum is equal to given number,N,https://practice.geeksforgeeks.org/problems/count-pairs-with-given-sum5022/1
19,19,19,19,19,Array,find common elements In 3 sorted arrays,N,https://practice.geeksforgeeks.org/problems/common-elements1132/1
20,20,20,20,20,Array,Rearrange the array in alternating positive and negative items with O(1) extra space,N,https://www.geeksforgeeks.org/rearrange-array-alternating-positive-negative-items-o1-extra-space/
21,21,21,21,21,Array,Find if there is any subarray with sum equal to 0,N,https://practice.geeksforgeeks.org/problems/subarray-with-0-sum/0
22,22,22,22,22,Array,Find factorial of a large number,N,https://practice.geeksforgeeks.org/problems/factorials-of-large-numbers/0
23,23,23,23,23,Array,find maximum product subarray ,N,https://practice.geeksforgeeks.org/problems/maximum-product-subarray3604/1
24,24,24,24,24,Array,Find longest coinsecutive subsequence,N,https://practice.geeksforgeeks.org/problems/longest-consecutive-subsequence/0
25,25,25,25,25,Array,"Given an array of size n and a number k, fin all elements that appear more than "" n/k "" times.",N,https://www.geeksforgeeks.org/given-an-array-of-of-size-n-finds-all-the-elements-that-appear-more-than-nk-times/
26,26,26,26,26,Array,Maximum profit by buying and selling a share atmost twice,N,https://www.geeksforgeeks.org/maximum-profit-by-buying-and-selling-a-share-at-most-twice/
27,27,27,27,27,Array,Find whether an array is a subset of another array,N,https://practice.geeksforgeeks.org/problems/array-subset-of-another-array/0
28,28,28,28,28,Array,Find the triplet that sum to a given value,N,https://practice.geeksforgeeks.org/problems/triplet-sum-in-array/0
29,29,29,29,29,Array,Trapping Rain water problem,N,https://practice.geeksforgeeks.org/problems/trapping-rain-water/0
30,30,30,30,30,Array,Chocolate Distribution problem,N,https://practice.geeksforgeeks.org/problems/chocolate-distribution-problem/0
31,31,31,31,31,Array,Smallest Subarray with sum greater than a given value,N,https://practice.geeksforgeeks.org/problems/smallest-subarray-with-sum-greater-than-x/0
32,32,32,32,32,Array,Three way partitioning of an array around a given value,N,https://practice.geeksforgeeks.org/problems/three-way-partitioning/1
33,33,33,33,33,Array,Minimum swaps required bring elements less equal K together,N,https://practice.geeksforgeeks.org/problems/minimum-swaps-required-to-bring-all-elements-less-than-or-equal-to-k-together/0
34,34,34,34,34,Array,Minimum no. of operations required to make an array palindrome,N,https://practice.geeksforgeeks.org/problems/palindromic-array/0
35,35,35,35,35,Array,Median of 2 sorted arrays of equal size,N,https://practice.geeksforgeeks.org/problems/find-the-median0527/1
36,36,36,36,36,Array,Median of 2 sorted arrays of different size,N,https://www.geeksforgeeks.org/median-of-two-sorted-arrays-of-different-sizes/
37,37,37,37,37,,,N,
38,38,38,38,38,,,N,
39,39,39,39,39,Matrix,Spiral traversal on a Matrix,N,https://practice.geeksforgeeks.org/problems/spirally-traversing-a-matrix/0
40,40,40,40,40,Matrix,Search an element in a matriix,N,https://leetcode.com/problems/search-a-2d-matrix/
41,41,41,41,41,Matrix,Find median in a row wise sorted matrix,N,https://practice.geeksforgeeks.org/problems/median-in-a-row-wise-sorted-matrix1527/1
42,42,42,42,42,Matrix,Find row with maximum no. of 1's,N,https://practice.geeksforgeeks.org/problems/row-with-max-1s0023/1
43,43,43,43,43,Matrix,Print elements in sorted order using row-column wise sorted matrix,N,https://practice.geeksforgeeks.org/problems/sorted-matrix/0
44,44,44,44,44,Matrix,Maximum size rectangle,N,https://practice.geeksforgeeks.org/problems/max-rectangle/1
45,45,45,45,45,Matrix,Find a specific pair in matrix,N,https://www.geeksforgeeks.org/find-a-specific-pair-in-matrix/
46,46,46,46,46,Matrix,Rotate matrix by 90 degrees,N,https://www.geeksforgeeks.org/rotate-a-matrix-by-90-degree-in-clockwise-direction-without-using-any-extra-space/
47,47,47,47,47,Matrix,Kth smallest element in a row-cpumn wise sorted matrix,N,https://practice.geeksforgeeks.org/problems/kth-element-in-matrix/1
48,48,48,48,48,Matrix,Common elements in all rows of a given matrix,N,https://www.geeksforgeeks.org/common-elements-in-all-rows-of-a-given-matrix/
49,49,49,49,49,,,,
50,50,50,50,50,,,,
51,51,51,51,51,String,Reverse a String,Y,https://leetcode.com/problems/reverse-string/
52,52,52,52,52,String,Check whether a String is Palindrome or not,Y,https://practice.geeksforgeeks.org/problems/palindrome-string0817/1
53,53,53,53,53,String,Find Duplicate characters in a string,Y,https://www.geeksforgeeks.org/print-all-the-duplicates-in-the-input-string/
54,54,54,54,54,String,Why strings are immutable in Java?,N,
55,55,55,55,55,String,Write a Code to check whether one string is a rotation of another,Y,https://www.geeksforgeeks.org/a-program-to-check-if-strings-are-rotations-of-each-other/
56,56,56,56,56,String,Write a Program to check whether a string is a valid shuffle of two strings or not,Y,https://www.programiz.com/java-programming/examples/check-valid-shuffle-of-strings
57,57,57,57,57,String,Count and Say problem,N,https://leetcode.com/problems/count-and-say/
58,58,58,58,58,String,Write a program to find the longest Palindrome in a string.[ Longest palindromic Substring],Y,https://practice.geeksforgeeks.org/problems/longest-palindrome-in-a-string/0
59,59,59,59,59,String,Find Longest Recurring Subsequence in String,N,https://practice.geeksforgeeks.org/problems/longest-repeating-subsequence/0
60,60,60,60,60,String,Print all Subsequences of a string.,N,https://www.geeksforgeeks.org/print-subsequences-string/
61,61,61,61,61,String,Print all the permutations of the given string,N,https://practice.geeksforgeeks.org/problems/permutations-of-a-given-string/0
62,62,62,62,62,String,Split the Binary string into two substring with equal 0’s and 1’s,N,https://www.geeksforgeeks.org/split-the-binary-string-into-substrings-with-equal-number-of-0s-and-1s/
63,63,63,63,63,String,Word Wrap Problem [VERY IMP].,N,https://practice.geeksforgeeks.org/problems/word-wrap/0
64,64,64,64,64,String,EDIT Distance [Very Imp],N,https://practice.geeksforgeeks.org/problems/edit-distance3702/1
65,65,65,65,65,String,Find next greater number with same set of digits. [Very Very IMP],N,https://practice.geeksforgeeks.org/problems/next-permutation/0
66,66,66,66,66,String,Balanced Parenthesis problem.[Imp],N,https://practice.geeksforgeeks.org/problems/parenthesis-checker/0
67,67,67,67,67,String,Word break Problem[ Very Imp],N,https://practice.geeksforgeeks.org/problems/word-break/0
68,68,68,68,68,String,Rabin Karp Algo,N,https://www.geeksforgeeks.org/rabin-karp-algorithm-for-pattern-searching/
69,69,69,69,69,String,KMP Algo,N,https://practice.geeksforgeeks.org/problems/longest-prefix-suffix2527/1
70,70,70,70,70,String,Convert a Sentence into its equivalent mobile numeric keypad sequence.,N,https://www.geeksforgeeks.org/convert-sentence-equivalent-mobile-numeric-keypad-sequence/
71,71,71,71,71,String,Minimum number of bracket reversals needed to make an expression balanced.,N,https://practice.geeksforgeeks.org/problems/count-the-reversals/0
72,72,72,72,72,String,Count All Palindromic Subsequence in a given String.,N,https://practice.geeksforgeeks.org/problems/count-palindromic-subsequences/1
73,73,73,73,73,String,Count of number of given string in 2D character array,N,https://www.geeksforgeeks.org/find-count-number-given-string-present-2d-character-array/
74,74,74,74,74,String,Search a Word in a 2D Grid of characters.,N,https://practice.geeksforgeeks.org/problems/find-the-string-in-grid/0
75,75,75,75,75,String,Boyer Moore Algorithm for Pattern Searching.,N,https://www.geeksforgeeks.org/boyer-moore-algorithm-for-pattern-searching/
76,76,76,76,76,String,Converting Roman Numerals to Decimal,N,https://practice.geeksforgeeks.org/problems/roman-number-to-integer/0
77,77,77,77,77,String,Longest Common Prefix,N,https://leetcode.com/problems/longest-common-prefix/
78,78,78,78,78,String,Number of flips to make binary string alternate,N,https://practice.geeksforgeeks.org/problems/min-number-of-flips/0
79,79,79,79,79,String,Find the first repeated word in string.,N,https://practice.geeksforgeeks.org/problems/second-most-repeated-string-in-a-sequence/0
80,80,80,80,80,String,Minimum number of swaps for bracket balancing.,N,https://practice.geeksforgeeks.org/problems/minimum-swaps-for-bracket-balancing/0
81,81,81,81,81,String,Find the longest common subsequence between two strings.,N,https://practice.geeksforgeeks.org/problems/longest-common-subsequence/0
82,82,82,82,82,String,Program to generate all possible valid IP addresses from given  string.,N,https://www.geeksforgeeks.org/program-generate-possible-valid-ip-addresses-given-string/
83,83,83,83,83,String,Write a program tofind the smallest window that contains all characters of string itself.,N,https://practice.geeksforgeeks.org/problems/smallest-distant-window/0
84,84,84,84,84,String,Rearrange characters in a string such that no two adjacent are same,N,https://practice.geeksforgeeks.org/problems/rearrange-characters/0
85,85,85,85,85,String,Minimum characters to be added at front to make string palindrome,N,https://www.geeksforgeeks.org/minimum-characters-added-front-make-string-palindrome/
86,86,86,86,86,String,"Given a sequence of words, print all anagrams together",N,https://practice.geeksforgeeks.org/problems/k-anagrams-1/0
87,87,87,87,87,String,Find the smallest window in a string containing all characters of another string,N,https://practice.geeksforgeeks.org/problems/smallest-window-in-a-string-containing-all-the-characters-of-another-string/0
88,88,88,88,88,String,Recursively remove all adjacent duplicates,N,https://practice.geeksforgeeks.org/problems/consecutive-elements/0
89,89,89,89,89,String,String matching where one string contains wildcard characters,N,https://practice.geeksforgeeks.org/problems/wildcard-string-matching/0
90,90,90,90,90,String,Function to find Number of customers who could not get a computer,N,https://www.geeksforgeeks.org/function-to-find-number-of-customers-who-could-not-get-a-computer/
91,91,91,91,91,String,Transform One String to Another using Minimum Number of Given Operation,N,https://www.geeksforgeeks.org/transform-one-string-to-another-using-minimum-number-of-given-operation/
92,92,92,92,92,String,Check if two given strings are isomorphic to each other,N,https://practice.geeksforgeeks.org/problems/isomorphic-strings/0
93,93,93,93,93,String,Recursively print all sentences that can be formed from list of word lists,N,https://www.geeksforgeeks.org/recursively-print-all-sentences-that-can-be-formed-from-list-of-word-lists/
94,94,94,94,94,,,,
95,95,95,95,95,,,,
96,96,96,96,96,Searching & Sorting,Find first and last positions of an element in a sorted array,N,https://practice.geeksforgeeks.org/problems/first-and-last-occurrences-of-x/0
97,97,97,97,97,Searching & Sorting,Find a Fixed Point (Value equal to index) in a given array,N,https://practice.geeksforgeeks.org/problems/value-equal-to-index-value1330/1
98,98,98,98,98,Searching & Sorting,Search in a rotated sorted array,N,https://leetcode.com/problems/search-in-rotated-sorted-array/
99,99,99,99,99,Searching & Sorting,square root of an integer,N,https://practice.geeksforgeeks.org/problems/count-squares3649/1
100,100,100,100,100,Searching & Sorting,Maximum and minimum of an array using minimum number of comparisons,N,https://practice.geeksforgeeks.org/problems/middle-of-three2926/1
101,101,101,101,101,Searching & Sorting,Optimum location of point to minimize total distance,N,https://www.geeksforgeeks.org/optimum-location-point-minimize-total-distance/
102,102,102,102,102,Searching & Sorting,Find the repeating and the missing,N,https://practice.geeksforgeeks.org/problems/find-missing-and-repeating2512/1
103,103,103,103,103,Searching & Sorting,find majority element,N,https://practice.geeksforgeeks.org/problems/majority-element/0
104,104,104,104,104,Searching & Sorting,Searching in an array where adjacent differ by at most k,N,https://www.geeksforgeeks.org/searching-array-adjacent-differ-k/
105,105,105,105,105,Searching & Sorting,find a pair with a given difference,N,https://practice.geeksforgeeks.org/problems/find-pair-given-difference/0
106,106,106,106,106,Searching & Sorting,find four elements that sum to a given value,N,https://practice.geeksforgeeks.org/problems/find-all-four-sum-numbers/0
107,107,107,107,107,Searching & Sorting,maximum sum such that no 2 elements are adjacent,N,https://practice.geeksforgeeks.org/problems/stickler-theif/0
108,108,108,108,108,Searching & Sorting,Count triplet with sum smaller than a given value,N,https://practice.geeksforgeeks.org/problems/count-triplets-with-sum-smaller-than-x5549/1
109,109,109,109,109,Searching & Sorting,merge 2 sorted arrays,N,https://practice.geeksforgeeks.org/problems/merge-two-sorted-arrays5135/1
110,110,110,110,110,Searching & Sorting,print all subarrays with 0 sum,N,https://practice.geeksforgeeks.org/problems/zero-sum-subarrays/0
111,111,111,111,111,Searching & Sorting,Product array Puzzle,N,https://practice.geeksforgeeks.org/problems/product-array-puzzle/0
112,112,112,112,112,Searching & Sorting,Sort array according to count of set bits,N,https://practice.geeksforgeeks.org/problems/sort-by-set-bit-count/0
113,113,113,113,113,Searching & Sorting,minimum no. of swaps required to sort the array,N,https://practice.geeksforgeeks.org/problems/minimum-swaps/1
114,114,114,114,114,Searching & Sorting,Bishu and Soldiers,N,https://www.hackerearth.com/practice/algorithms/searching/binary-search/practice-problems/algorithm/bishu-and-soldiers/
115,115,115,115,115,Searching & Sorting,Rasta and Kheshtak,N,https://www.hackerearth.com/practice/algorithms/searching/binary-search/practice-problems/algorithm/rasta-and-kheshtak/
116,116,116,116,116,Searching & Sorting,Kth smallest number again,N,https://www.hackerearth.com/practice/algorithms/searching/binary-search/practice-problems/algorithm/kth-smallest-number-again-2/
117,117,117,117,117,Searching & Sorting,Find pivot element in a sorted array,N,http://theoryofprogramming.com/2017/12/16/find-pivot-element-sorted-rotated-array/
118,118,118,118,118,Searching & Sorting,K-th Element of Two Sorted Arrays,N,https://practice.geeksforgeeks.org/problems/k-th-element-of-two-sorted-array/0
119,119,119,119,119,Searching & Sorting,Aggressive cows,N,https://www.spoj.com/problems/AGGRCOW/
120,120,120,120,120,Searching & Sorting,Book Allocation Problem,N,https://practice.geeksforgeeks.org/problems/allocate-minimum-number-of-pages/0
121,121,121,121,121,Searching & Sorting,EKOSPOJ:,N,https://www.spoj.com/problems/EKO/
122,122,122,122,122,Searching & Sorting,Job Scheduling Algo,N,https://www.geeksforgeeks.org/weighted-job-scheduling-log-n-time/
123,123,123,123,123,Searching & Sorting,Missing Number in AP,N,https://practice.geeksforgeeks.org/problems/arithmetic-number/0
124,124,124,124,124,Searching & Sorting,Smallest number with atleastn trailing zeroes infactorial,N,https://practice.geeksforgeeks.org/problems/smallest-factorial-number5929/1
125,125,125,125,125,Searching & Sorting,Painters Partition Problem:,N,https://practice.geeksforgeeks.org/problems/allocate-minimum-number-of-pages/0
126,126,126,126,126,Searching & Sorting,ROTI-Prata SPOJ,N,https://www.spoj.com/problems/PRATA/
127,127,127,127,127,Searching & Sorting,DoubleHelix SPOJ,N,https://www.spoj.com/problems/ANARC05B/
128,128,128,128,128,Searching & Sorting,Subset Sums,N,https://www.spoj.com/problems/SUBSUMS/
129,129,129,129,129,Searching & Sorting,Findthe inversion count,N,https://practice.geeksforgeeks.org/problems/inversion-of-array/0
130,130,130,130,130,Searching & Sorting,Implement Merge-sort in-place,N,https://www.geeksforgeeks.org/in-place-merge-sort/
131,131,131,131,131,Searching & Sorting,Partitioning and Sorting Arrays with Many Repeated Entries,N,https://www.baeldung.com/java-sorting-arrays-with-repeated-entries
132,132,132,132,132,,,,
133,133,133,133,133,,,,
134,134,134,134,134,LinkedList,Write a Program to reverse the Linked List. (Both Iterative and recursive),N,https://www.geeksforgeeks.org/reverse-a-linked-list/
135,135,135,135,135,LinkedList,Reverse a Linked List in group of Given Size. [Very Imp],N,https://practice.geeksforgeeks.org/problems/reverse-a-linked-list-in-groups-of-given-size/1
136,136,136,136,136,LinkedList,Write a program to Detect loop in a linked list.,N,https://practice.geeksforgeeks.org/problems/detect-loop-in-linked-list/1
137,137,137,137,137,LinkedList,Write a program to Delete loop in a linked list.,N,https://practice.geeksforgeeks.org/problems/remove-loop-in-linked-list/1
138,138,138,138,138,LinkedList,Find the starting point of the loop. ,N,https://www.geeksforgeeks.org/find-first-node-of-loop-in-a-linked-list/
139,139,139,139,139,LinkedList,Remove Duplicates in a sorted Linked List.,N,https://practice.geeksforgeeks.org/problems/remove-duplicate-element-from-sorted-linked-list/1
140,140,140,140,140,LinkedList,Remove Duplicates in a Un-sorted Linked List.,N,https://practice.geeksforgeeks.org/problems/remove-duplicates-from-an-unsorted-linked-list/1
141,141,141,141,141,LinkedList,Write a Program to Move the last element to Front in a Linked List.,N,https://www.geeksforgeeks.org/move-last-element-to-front-of-a-given-linked-list/
142,142,142,142,142,LinkedList,Add “1” to a number represented as a Linked List.,N,https://practice.geeksforgeeks.org/problems/add-1-to-a-number-represented-as-linked-list/1
143,143,143,143,143,LinkedList,Add two numbers represented by linked lists.,N,https://practice.geeksforgeeks.org/problems/add-two-numbers-represented-by-linked-lists/1
144,144,144,144,144,LinkedList,Intersection of two Sorted Linked List.,N,https://practice.geeksforgeeks.org/problems/intersection-of-two-sorted-linked-lists/1
145,145,145,145,145,LinkedList,Intersection Point of two Linked Lists.,N,https://practice.geeksforgeeks.org/problems/intersection-point-in-y-shapped-linked-lists/1
146,146,146,146,146,LinkedList,Merge Sort For Linked lists.[Very Important],N,https://practice.geeksforgeeks.org/problems/sort-a-linked-list/1
147,147,147,147,147,LinkedList,Quicksort for Linked Lists.[Very Important],N,https://practice.geeksforgeeks.org/problems/quick-sort-on-linked-list/1
148,148,148,148,148,LinkedList,Find the middle Element of a linked list.,N,https://leetcode.com/problems/middle-of-the-linked-list/
149,149,149,149,149,LinkedList,Check if a linked list is a circular linked list.,N,https://practice.geeksforgeeks.org/problems/circular-linked-list/1
150,150,150,150,150,LinkedList,Split a Circular linked list into two halves.,N,https://practice.geeksforgeeks.org/problems/split-a-circular-linked-list-into-two-halves/1
151,151,151,151,151,LinkedList,Write a Program to check whether the Singly Linked list is a palindrome or not.,N,https://practice.geeksforgeeks.org/problems/check-if-linked-list-is-pallindrome/1
152,152,152,152,152,LinkedList,Deletion from a Circular Linked List.,N,https://www.geeksforgeeks.org/deletion-circular-linked-list/
153,153,153,153,153,LinkedList,Reverse a Doubly Linked list.,N,https://practice.geeksforgeeks.org/problems/reverse-a-doubly-linked-list/1
154,154,154,154,154,LinkedList,Find pairs with a given sum in a DLL.,N,https://www.geeksforgeeks.org/find-pairs-given-sum-doubly-linked-list/
155,155,155,155,155,LinkedList,Count triplets in a sorted DLL whose sum is equal to given value “X”.,N,https://www.geeksforgeeks.org/count-triplets-sorted-doubly-linked-list-whose-sum-equal-given-value-x/
156,156,156,156,156,LinkedList,Sort a “k”sorted Doubly Linked list.[Very IMP],N,https://www.geeksforgeeks.org/sort-k-sorted-doubly-linked-list/
157,157,157,157,157,LinkedList,Rotate DoublyLinked list by N nodes.,N,https://www.geeksforgeeks.org/rotate-doubly-linked-list-n-nodes/
158,158,158,158,158,LinkedList,Rotate a Doubly Linked list in group of Given Size.[Very IMP],N,https://www.geeksforgeeks.org/reverse-doubly-linked-list-groups-given-size/
159,159,159,159,159,LinkedList,Can we reverse a linked list in less than O(n) ?,N,
160,160,160,160,160,LinkedList,Why Quicksort is preferred for. Arrays and Merge Sort for LinkedLists ?,N,
161,161,161,161,161,LinkedList,Flatten a Linked List,N,https://practice.geeksforgeeks.org/problems/flattening-a-linked-list/1
162,162,162,162,162,LinkedList,"Sort a LL of 0's, 1's and 2's",N,https://practice.geeksforgeeks.org/problems/given-a-linked-list-of-0s-1s-and-2s-sort-it/1
163,163,163,163,163,LinkedList,Clone a linked list with next and random pointer,N,https://practice.geeksforgeeks.org/problems/clone-a-linked-list-with-next-and-random-pointer/1
164,164,164,164,164,LinkedList,Merge K sorted Linked list,N,https://practice.geeksforgeeks.org/problems/merge-k-sorted-linked-lists/1
165,165,165,165,165,LinkedList,Multiply 2 no. represented by LL,N,https://practice.geeksforgeeks.org/problems/multiply-two-linked-lists/1
166,166,166,166,166,LinkedList,Delete nodes which have a greater value on right side,N,https://practice.geeksforgeeks.org/problems/delete-nodes-having-greater-value-on-right/1
167,167,167,167,167,LinkedList,Segregate even and odd nodes in a Linked List,N,https://practice.geeksforgeeks.org/problems/segregate-even-and-odd-nodes-in-a-linked-list/0
168,168,168,168,168,LinkedList,Program for n’th node from the end of a Linked List,N,https://practice.geeksforgeeks.org/problems/nth-node-from-end-of-linked-list/1
169,169,169,169,169,LinkedList,Find the first non-repeating character from a stream of characters,N,https://practice.geeksforgeeks.org/problems/first-non-repeating-character-in-a-stream/0
170,170,170,170,170,,,,
171,171,171,171,171,,,,
172,172,172,172,172,Binary Trees,level order traversal,Y,https://practice.geeksforgeeks.org/problems/level-order-traversal/1
173,173,173,173,173,Binary Trees,Reverse Level Order traversal,Y,https://practice.geeksforgeeks.org/problems/reverse-level-order-traversal/1
174,174,174,174,174,Binary Trees,Height of a tree,N,https://practice.geeksforgeeks.org/problems/height-of-binary-tree/1
175,175,175,175,175,Binary Trees,Diameter of a tree,N,https://practice.geeksforgeeks.org/problems/diameter-of-binary-tree/1
176,176,176,176,176,Binary Trees,Mirror of a tree,N,https://www.geeksforgeeks.org/create-a-mirror-tree-from-the-given-binary-tree/
177,177,177,177,177,Binary Trees,Inorder Traversal of a tree both using recursion and Iteration,N,https://www.techiedelight.com/inorder-tree-traversal-iterative-recursive/
178,178,178,178,178,Binary Trees,Preorder Traversal of a tree both using recursion and Iteration,N,https://www.techiedelight.com/preorder-tree-traversal-iterative-recursive/
179,179,179,179,179,Binary Trees,Postorder Traversal of a tree both using recursion and Iteration,N,https://www.techiedelight.com/postorder-tree-traversal-iterative-recursive/
180,180,180,180,180,Binary Trees,Left View of a tree,N,https://practice.geeksforgeeks.org/problems/left-view-of-binary-tree/1
181,181,181,181,181,Binary Trees,Right View of Tree,N,https://practice.geeksforgeeks.org/problems/right-view-of-binary-tree/1
182,182,182,182,182,Binary Trees,Top View of a tree,N,https://practice.geeksforgeeks.org/problems/top-view-of-binary-tree/1
183,183,183,183,183,Binary Trees,Bottom View of a tree,N,https://practice.geeksforgeeks.org/problems/bottom-view-of-binary-tree/1
184,184,184,184,184,Binary Trees,Zig-Zag traversal of a binary tree,N,https://practice.geeksforgeeks.org/problems/zigzag-tree-traversal/1
